[
    {
        "unique_id": "pBpLPQ7kg6mkBpNMMPdCD",
        "name": "Herz von Fyendal",
        "pitch": "3",
        "cost": "",
        "power": "",
        "defense": "",
        "health": "",
        "intelligence": "",
        "types": [
            "Allgemein",
            "Ressource",
            "Edelstein"
        ],
        "card_keywords": [
            "Legendär"
        ],
        "abilities_and_effects": [],
        "ability_and_effect_keywords": [],
        "granted_keywords": [],
        "removed_keywords": [],
        "interacts_with_keywords": [],
        "functional_text": "**Legendär** *(Du darfst Herz von Fyendal nur einmal in deinem Deck haben.)*\n\nWenn du Herz von Fyendal pitchst und weniger {h} als ein gegnerischer Held hast, erhälst du 1{h}.",
        "functional_text_plain": "Legendär (Du darfst Herz von Fyendal nur einmal in deinem Deck haben.)\nWenn du Herz von Fyendal pitchst und weniger {h} als ein gegnerischer Held hast, erhälst du 1{h}.",
        "type_text": "Allgemein Ressource - Edelstein",
        "played_horizontally": false,
        "blitz_legal": true,
        "cc_legal": true,
        "commoner_legal": false,
        "blitz_living_legend": false,
        "cc_living_legend": false,
        "blitz_banned": false,
        "cc_banned": false,
        "commoner_banned": false,
        "upf_banned": false,
        "blitz_suspended": false,
        "cc_suspended": false,
        "commoner_suspended": false,
        "ll_restricted": false,
        "printings": [
            {
                "unique_id": "fWrG7GN6Wh9GkNBjWdkkh",
                "set_printing_unique_id": "TJn6DFWGBDfHJMntFCcmR",
                "id": "1HP000",
                "set_id": "1HP",
                "edition": "N",
                "foiling": "R",
                "rarity": "F",
                "expansion_slot": false,
                "artist": "Adolfo Navarro",
                "art_variation": null,
                "flavor_text": "",
                "flavor_text_plain": "",
                "image_url": "https://storage.googleapis.com/fabmaster/cardfaces/2022-1HP/DE/DE_1HP000_1.png"
            }
        ]
    },
    {
        "unique_id": "N77hdGp96fNQnzc79hqN9",
        "name": "Auge von Ophidia",
        "pitch": "3",
        "cost": "",
        "power": "",
        "defense": "",
        "health": "",
        "intelligence": "",
        "types": [
            "Allgemein",
            "Ressource",
            "Edelstein"
        ],
        "card_keywords": [
            "Legendär",
            "Sortiere 2 um"
        ],
        "abilities_and_effects": [],
        "ability_and_effect_keywords": [],
        "granted_keywords": [],
        "removed_keywords": [],
        "interacts_with_keywords": [],
        "functional_text": "**Legendär** *(Du darfst Auge von Ophidia nur einmal in deinem Deck haben.)*\n\nWenn du Auge von Ophidia pitchst, **sortiere 2 um**.",
        "functional_text_plain": "Legendär (Du darfst Auge von Ophidia nur einmal in deinem Deck haben.)\nWenn du Auge von Ophidia pitchst, sortiere 2 um.",
        "type_text": "Allgemein Ressource - Edelstein",
        "played_horizontally": false,
        "blitz_legal": true,
        "cc_legal": true,
        "commoner_legal": false,
        "blitz_living_legend": false,
        "cc_living_legend": false,
        "blitz_banned": false,
        "cc_banned": false,
        "commoner_banned": false,
        "upf_banned": false,
        "blitz_suspended": false,
        "cc_suspended": false,
        "commoner_suspended": false,
        "ll_restricted": false,
        "printings": [
            {
                "unique_id": "zrDP7JGF6hnMLhTrpHRhK",
                "set_printing_unique_id": "TJn6DFWGBDfHJMntFCcmR",
                "id": "1HP000",
                "set_id": "1HP",
                "edition": "N",
                "foiling": "R",
                "rarity": "F",
                "expansion_slot": false,
                "artist": "Alexandra Malygina",
                "art_variation": null,
                "flavor_text": "",
                "flavor_text_plain": "",
                "image_url": "https://storage.googleapis.com/fabmaster/cardfaces/2022-1HP/DE/DE_1HP000_2.png"
            }
        ]
    },
    {
        "unique_id": "pkMGCRh9fDT98dRgnQF8W",
        "name": "Scherbe der Erznacht",
        "pitch": "3",
        "cost": "",
        "power": "",
        "defense": "",
        "health": "",
        "intelligence": "",
        "types": [
            "Runenklinge",
            "Ressource",
            "Edelstein"
        ],
        "card_keywords": [
            "Legendär",
            "Viserai-Spezialisierung"
        ],
        "abilities_and_effects": [],
        "ability_and_effect_keywords": [],
        "granted_keywords": [],
        "removed_keywords": [],
        "interacts_with_keywords": [],
        "functional_text": "**Legendäre Viserai-Spezialisierung** *(Du darfst Scherbe der Erznacht nur einmal in deinem Deck haben und nur dann, wenn Viserai dein Held ist.)*\n\nWenn du Scherbe der Erznacht pitchst, erstelle ein Runengesang-Token.",
        "functional_text_plain": "Legendäre Viserai-Spezialisierung (Du darfst Scherbe der Erznacht nur einmal in deinem Deck haben und nur dann, wenn Viserai dein Held ist.)\nWenn du Scherbe der Erznacht pitchst, erstelle ein Runengesang-Token.",
        "type_text": "Runenklinge Ressource - Edelstein",
        "played_horizontally": false,
        "blitz_legal": true,
        "cc_legal": true,
        "commoner_legal": false,
        "blitz_living_legend": false,
        "cc_living_legend": false,
        "blitz_banned": false,
        "cc_banned": false,
        "commoner_banned": false,
        "upf_banned": false,
        "blitz_suspended": false,
        "cc_suspended": false,
        "commoner_suspended": false,
        "ll_restricted": false,
        "printings": [
            {
                "unique_id": "BLNk76c8brjQGFJGdT9Km",
                "set_printing_unique_id": "TJn6DFWGBDfHJMntFCcmR",
                "id": "1HP000",
                "set_id": "1HP",
                "edition": "N",
                "foiling": "R",
                "rarity": "F",
                "expansion_slot": false,
                "artist": "Maxim Kostin",
                "art_variation": null,
                "flavor_text": "",
                "flavor_text_plain": "",
                "image_url": "https://storage.googleapis.com/fabmaster/cardfaces/2022-1HP/DE/DE_1HP000_3.png"
            }
        ]
    }
]