[
    {
        "unique_id": "pBpLPQ7kg6mkBpNMMPdCD",
        "name": "Cœur de Fyendal",
        "pitch": "3",
        "cost": "",
        "power": "",
        "defense": "",
        "health": "",
        "intelligence": "",
        "types": [
            "Générique",
            "Ressource",
            "Pierre précieuse"
        ],
        "card_keywords": [
            "Légendaire"
        ],
        "abilities_and_effects": [],
        "ability_and_effect_keywords": [],
        "granted_keywords": [],
        "removed_keywords": [],
        "interacts_with_keywords": [],
        "functional_text": "**Légendaire** *(Vous ne pouvez avoir qu''un Cœur de Fyendal dans votre deck.)*\n\nLorsque vous lancez Coeur de Fyendal, si vous avez moins de {h} que votre adversaire, gagnez 1{h}.",
        "functional_text_plain": "Légendaire (Vous ne pouvez avoir qu''un Cœur de Fyendal dans votre deck.)\nLorsque vous lancez Coeur de Fyendal, si vous avez moins de {h} que votre adversaire, gagnez 1{h}.",
        "type_text": "Générique Ressource - Pierre précieuse",
        "played_horizontally": false,
        "blitz_legal": true,
        "cc_legal": true,
        "commoner_legal": false,
        "blitz_living_legend": false,
        "cc_living_legend": false,
        "blitz_banned": false,
        "cc_banned": false,
        "commoner_banned": false,
        "upf_banned": false,
        "blitz_suspended": false,
        "cc_suspended": false,
        "commoner_suspended": false,
        "ll_restricted": false,
        "printings": [
            {
                "unique_id": "zPG97HKzdmzJGdncK8nnG",
                "set_printing_unique_id": "qKwMnMt9wnQzGpw7jLLbj",
                "id": "1HP000",
                "set_id": "1HP",
                "edition": "N",
                "foiling": "R",
                "rarity": "F",
                "expansion_slot": false,
                "artist": "Adolfo Navarro",
                "art_variation": null,
                "flavor_text": "",
                "flavor_text_plain": "",
                "image_url": "https://storage.googleapis.com/fabmaster/cardfaces/2022-1HP/FR/FR_1HP000_1.png"
            }
        ]
    },
    {
        "unique_id": "N77hdGp96fNQnzc79hqN9",
        "name": "Œil d'Ophidie",
        "pitch": "3",
        "cost": "",
        "power": "",
        "defense": "",
        "health": "",
        "intelligence": "",
        "types": [
            "Générique",
            "Ressource",
            "Pierre précieuse"
        ],
        "card_keywords": [
            "Légendaire",
            "Optez 2"
        ],
        "abilities_and_effects": [],
        "ability_and_effect_keywords": [],
        "granted_keywords": [],
        "removed_keywords": [],
        "interacts_with_keywords": [],
        "functional_text": "**Légendaire** *(Vous ne pouvez avoir qu''un Œil d''Ophidie dans votre deck.)*\n\nLorsque vous lanchez Œil d''Ophidie, **optez 2**.",
        "functional_text_plain": "Légendaire (Vous ne pouvez avoir qu''un Œil d''Ophidie dans votre deck.)\nLorsque vous lanchez Œil d''Ophidie, optez 2.",
        "type_text": "Générique Ressource - Pierre précieuse",
        "played_horizontally": false,
        "blitz_legal": true,
        "cc_legal": true,
        "commoner_legal": false,
        "blitz_living_legend": false,
        "cc_living_legend": false,
        "blitz_banned": false,
        "cc_banned": false,
        "commoner_banned": false,
        "upf_banned": false,
        "blitz_suspended": false,
        "cc_suspended": false,
        "commoner_suspended": false,
        "ll_restricted": false,
        "printings": [
            {
                "unique_id": "BBqrPDLK8RpDLfF99Cr8d",
                "set_printing_unique_id": "qKwMnMt9wnQzGpw7jLLbj",
                "id": "1HP000",
                "set_id": "1HP",
                "edition": "N",
                "foiling": "R",
                "rarity": "F",
                "expansion_slot": false,
                "artist": "Alexandra Malygina",
                "art_variation": null,
                "flavor_text": "",
                "flavor_text_plain": "",
                "image_url": "https://storage.googleapis.com/fabmaster/cardfaces/2022-1HP/FR/FR_1HP000_2.png"
            }
        ]
    },
    {
        "unique_id": "pkMGCRh9fDT98dRgnQF8W",
        "name": "Éclat d'Archenuit",
        "pitch": "3",
        "cost": "",
        "power": "",
        "defense": "",
        "health": "",
        "intelligence": "",
        "types": [
            "Lamederune",
            "Ressource",
            "Pierre précieuse"
        ],
        "card_keywords": [
            "Légendaire",
            "Spécialisation de Viserai"
        ],
        "abilities_and_effects": [],
        "ability_and_effect_keywords": [],
        "granted_keywords": [],
        "removed_keywords": [],
        "interacts_with_keywords": [],
        "functional_text": "**Spécialisation de Viserai légendaire** *(Vous ne pouvez avoir qu''un Éclat d''Archenuit dans votre deck et uniquement si Viserai est votre héros.)*\n\nLorsque vous lanchez Éclat d''Archenuit, créez un jeton Chantderune.",
        "functional_text_plain": "Spécialisation de Viserai légendaire (Vous ne pouvez avoir qu''un Éclat d''Archenuit dans votre deck et uniquement si Viserai est votre héros.)\nLorsque vous lanchez Éclat d''Archenuit, créez un jeton Chantderune.",
        "type_text": "Lamederune Ressource - Pierre précieuse",
        "played_horizontally": false,
        "blitz_legal": true,
        "cc_legal": true,
        "commoner_legal": false,
        "blitz_living_legend": false,
        "cc_living_legend": false,
        "blitz_banned": false,
        "cc_banned": false,
        "commoner_banned": false,
        "upf_banned": false,
        "blitz_suspended": false,
        "cc_suspended": false,
        "commoner_suspended": false,
        "ll_restricted": false,
        "printings": [
            {
                "unique_id": "LQmdBgHpTGLTpLmftWkbz",
                "set_printing_unique_id": "qKwMnMt9wnQzGpw7jLLbj",
                "id": "1HP000",
                "set_id": "1HP",
                "edition": "N",
                "foiling": "R",
                "rarity": "F",
                "expansion_slot": false,
                "artist": "Maxim Kostin",
                "art_variation": null,
                "flavor_text": "",
                "flavor_text_plain": "",
                "image_url": "https://storage.googleapis.com/fabmaster/cardfaces/2022-1HP/FR/FR_1HP000_3.png"
            }
        ]
    }
]