[
    {
        "unique_id": "pBpLPQ7kg6mkBpNMMPdCD",
        "name": "Corazón de Fyendal",
        "pitch": "3",
        "cost": "",
        "power": "",
        "defense": "",
        "health": "",
        "intelligence": "",
        "types": [
            "Genérico",
            "Recurso",
            "Gema"
        ],
        "card_keywords": [
            "Legendario"
        ],
        "abilities_and_effects": [],
        "ability_and_effect_keywords": [],
        "granted_keywords": [],
        "removed_keywords": [],
        "interacts_with_keywords": [],
        "functional_text": "**Legendario** *(Solo puedes tener un Corazón de Fyendal en el mazo).*\n\nCuando lanzas Corazón de Fyendal, si tienes menos {h} que un héroe oponente, ganas 1{h}.",
        "functional_text_plain": "Legendario (Solo puedes tener un Corazón de Fyendal en el mazo).\nCuando lanzas Corazón de Fyendal, si tienes menos {h} que un héroe oponente, ganas 1{h}.",
        "type_text": "Recurso genérico - Gema",
        "played_horizontally": false,
        "blitz_legal": true,
        "cc_legal": true,
        "commoner_legal": false,
        "blitz_living_legend": false,
        "cc_living_legend": false,
        "blitz_banned": false,
        "cc_banned": false,
        "commoner_banned": false,
        "upf_banned": false,
        "blitz_suspended": false,
        "cc_suspended": false,
        "commoner_suspended": false,
        "ll_restricted": false,
        "printings": [
            {
                "unique_id": "6RhqmkWDRpdRmrrTTdj6w",
                "set_printing_unique_id": "dWtbGKG8Rb9dPrCLBr6nj",
                "id": "1HP000",
                "set_id": "1HP",
                "edition": "N",
                "foiling": "R",
                "rarity": "F",
                "expansion_slot": false,
                "artist": "Adolfo Navarro",
                "art_variation": null,
                "flavor_text": "",
                "flavor_text_plain": "",
                "image_url": "https://storage.googleapis.com/fabmaster/cardfaces/2022-1HP/SP/SP_1HP000_1.png"
            }
        ]
    },
    {
        "unique_id": "N77hdGp96fNQnzc79hqN9",
        "name": "Ojo de Ofidia",
        "pitch": "3",
        "cost": "",
        "power": "",
        "defense": "",
        "health": "",
        "intelligence": "",
        "types": [
            "Genérico",
            "Recurso",
            "Gema"
        ],
        "card_keywords": [
            "Legendario",
            "Opta 2"
        ],
        "abilities_and_effects": [],
        "ability_and_effect_keywords": [],
        "granted_keywords": [],
        "removed_keywords": [],
        "interacts_with_keywords": [],
        "functional_text": "**Legendario** *(Solo puedes tener un Ojo de Ofidia en el mazo).*\n\nCuando lanzas Ojo de Ofidia, **opta 2**.",
        "functional_text_plain": "Legendario (Solo puedes tener un Ojo de Ofidia en el mazo).\nCuando lanzas Ojo de Ofidia, opta 2.",
        "type_text": "Recurso genérico - Gema",
        "played_horizontally": false,
        "blitz_legal": true,
        "cc_legal": true,
        "commoner_legal": false,
        "blitz_living_legend": false,
        "cc_living_legend": false,
        "blitz_banned": false,
        "cc_banned": false,
        "commoner_banned": false,
        "upf_banned": false,
        "blitz_suspended": false,
        "cc_suspended": false,
        "commoner_suspended": false,
        "ll_restricted": false,
        "printings": [
            {
                "unique_id": "d7tFLfJQkTJbzbD8PrnBR",
                "set_printing_unique_id": "dWtbGKG8Rb9dPrCLBr6nj",
                "id": "1HP000",
                "set_id": "1HP",
                "edition": "N",
                "foiling": "R",
                "rarity": "F",
                "expansion_slot": false,
                "artist": "Alexandra Malygina",
                "art_variation": null,
                "flavor_text": "",
                "flavor_text_plain": "",
                "image_url": "https://storage.googleapis.com/fabmaster/cardfaces/2022-1HP/SP/SP_1HP000_2.png"
            }
        ]
    },
    {
        "unique_id": "pkMGCRh9fDT98dRgnQF8W",
        "name": "Fragmento del archicaballero",
        "pitch": "3",
        "cost": "",
        "power": "",
        "defense": "",
        "health": "",
        "intelligence": "",
        "types": [
            "Filorruna",
            "Recurso",
            "Gema"
        ],
        "card_keywords": [
            "Legendario",
            "Especialización de Viserai"
        ],
        "abilities_and_effects": [],
        "ability_and_effect_keywords": [],
        "granted_keywords": [],
        "removed_keywords": [],
        "interacts_with_keywords": [],
        "functional_text": "**Legendario** *(Solo puedes tener un Fragmento del archicaballero en el mazo, y solo si tu héroe es Viserai).*\n\nCuando lanzas a Fragmento del archicaballero, crea una ficha de Canto de runas",
        "functional_text_plain": "Legendario (Solo puedes tener un Fragmento del archicaballero en el mazo, y solo si tu héroe es Viserai).\nCuando lanzas a Fragmento del archicaballero, crea una ficha de Canto de runas",
        "type_text": "Recurso de filorruna - Gema",
        "played_horizontally": false,
        "blitz_legal": true,
        "cc_legal": true,
        "commoner_legal": false,
        "blitz_living_legend": false,
        "cc_living_legend": false,
        "blitz_banned": false,
        "cc_banned": false,
        "commoner_banned": false,
        "upf_banned": false,
        "blitz_suspended": false,
        "cc_suspended": false,
        "commoner_suspended": false,
        "ll_restricted": false,
        "printings": [
            {
                "unique_id": "p6bPbDJwq6fFFNGfzrjKP",
                "set_printing_unique_id": "dWtbGKG8Rb9dPrCLBr6nj",
                "id": "1HP000",
                "set_id": "1HP",
                "edition": "N",
                "foiling": "R",
                "rarity": "F",
                "expansion_slot": false,
                "artist": "Maxim Kostin",
                "art_variation": null,
                "flavor_text": "",
                "flavor_text_plain": "",
                "image_url": "https://storage.googleapis.com/fabmaster/cardfaces/2022-1HP/SP/SP_1HP000_3.png"
            }
        ]
    }
]